{
  "manifest_version": 1,
  "release": "25.12.6",
  "generated": "2026-10-28T00:00:00Z",
  "boards": {
    "mifib-v12,generic": {
      "version": "25.12.6-r3",
      "revision": "r3",
      "sysupgrade": "https://akbar-npj.github.io/msm8916-openwrt/releases/25.12.6/targets/msm89xx/msm8916/mifib-v12-sysupgrade.bin",
      "sha256": "0000000000000000000000000000000000000000000000000000000000000000",
      "size": 9437184,
      "min_version": "25.12.6-r1",
      "notes": "https://github.com/akbar-npj/msm8916-openwrt/releases/tag/25.12.6-r3",
      "published": "2026-10-28"
    },
    "hmu05,generic": {
      "version": "25.12.6-r3",
      "revision": "r3",
      "sysupgrade": "https://akbar-npj.github.io/msm8916-openwrt/releases/25.12.6/targets/msm89xx/msm8916/hmu05-sysupgrade.bin",
      "sha256": "0000000000000000000000000000000000000000000000000000000000000000",
      "size": 9437184,
      "min_version": "25.12.6-r1",
      "notes": "https://github.com/akbar-npj/msm8916-openwrt/releases/tag/25.12.6-r3",
      "published": "2026-10-28"
    }
  }
}
